{
  "version": "1",
  "change_id": "add-concurrent-last-unit-safety",
  "summary": "W1 foundation: apply standard additive OpenAPI docs so reserve InsufficientStockError is the shared named channel for sequential insufficient stock and concurrent race losers (keep UnauthorizedError); apply standard UML OCL on Reservation::reserve (and module invariant) so InsufficientStockError naming and non-negative available stock are checkable on sequential/contract-testable paths; defer formal to W2; contracts-only elevation satisfies W1 acceptance—implement not required unless apply leaves a checkability gap.",
  "confidence": "high",
  "human_gate": {
    "required": false,
    "reason": "Additive OpenAPI + OCL vocabulary elevation (InsufficientStockError race-loser channel + non-negative available stock); no money_boundary, breaking_change, low_confidence, or formal apply on this slice. Formal apply remains W2 / Phase 3."
  },
  "targets": [
    {
      "kind": "api",
      "location": "openapi/openapi.yaml#/paths/~1reservations/post",
      "density": "standard",
      "rationale": "http_boundary + additive_change + stable_core: W1 (R3/R5/SC3/SC5) requires clients/tests to observe that concurrent race losers use the same named InsufficientStockError channel as sequential insufficient stock, without removing or renaming prior success or error surfaces. Elevate openapi/openapi.yaml (POST /reservations descriptions/examples and InsufficientStockError response/schema wording) additively so race-loser semantics are first-class documentation on the existing errorType; keep UnauthorizedError and other named channels in force. Not breaking_change. Density standard per project defaults for additive API elevation.",
      "adapter_hint": "openapi",
      "status": "apply",
      "covers": ["W1"],
      "signals": ["http_boundary", "additive_change", "stable_core"],
      "breaking": false,
      "confidence": "high",
      "human_gate": {
        "required": false,
        "reason": "Additive documentation of race-loser InsufficientStockError on existing reserve operation; no breaking API change."
      }
    },
    {
      "kind": "dbc",
      "location": "contracts/Reservation.ocl#reserve",
      "density": "standard",
      "rationale": "domain_contract + additive_change + stable_core: W1 (R3/R6/SC3/SC5) requires UML OCL so InsufficientStockError naming (including race-loser as the same named channel for contract-testable paths) and non-negative available stock are checkable without thinning prior reserve posts. Extend contracts/Reservation.ocl—elevate InsufficientStockError / no-extra-hold / stock-unchanged failure posts and add a checkable non-negative availableStock invariant (or equivalent sequential posts); UnauthorizedErrorOnReserve posts remain. Full interleaving last-unit exclusivity stays W2. Density standard per project defaults for additive DbC.",
      "adapter_hint": "ocl",
      "status": "apply",
      "covers": ["W1"],
      "signals": ["domain_contract", "additive_change", "stable_core"],
      "breaking": false,
      "confidence": "high",
      "human_gate": {
        "required": false,
        "reason": "Standard additive DbC vocabulary/invariant elevation; no money or formal apply on W1."
      }
    },
    {
      "kind": "formal",
      "location": "formal/",
      "density": "thin",
      "rationale": "concurrency_safety is in scope for this change (NFR1/R1–R2/R7) but WorkPlan assigns bounded TLA+/TLC under formal/ to W2. W1 is foundation OpenAPI+OCL only; Phase 3 formal apply conditions are not met on this slice. Defer with adapter_hint defer-formal rather than silently dropping the formal need.",
      "adapter_hint": "defer-formal",
      "status": "defer",
      "covers": ["W1"],
      "signals": ["concurrency_safety"],
      "breaking": false,
      "confidence": "high",
      "human_gate": {
        "required": false,
        "reason": "Formal deferred to W2; no Phase 3 formal apply on this foundation slice."
      }
    }
  ]
}
